fecha,idT,Likes,ReTweets,Positividad,txt
2018-09-02 21:14:13,1036361680396185606,60,9,0.030613812746566504,"Semana intensa en Lima Este. De lunes a miércoles en SJL. El viernes en Ate, ayer en Chaclacayo y hoy linda caminata en Chosica. Eliminando corrupción, disminuyendo el crimen, logrando una movilidad sostenible y con lograremos una"
2018-09-02 21:14:13,1036361680396185606,60,9,0.030613812746566504,"Semana intensa en Lima Este. De lunes a miércoles en SJL. El viernes en Ate, ayer en Chaclacayo y hoy linda caminata en Chosica. Eliminando corrupción, disminuyendo el crimen, logrando una movilidad sostenible y con lograremos una"
2018-09-02 22:24:54,1036379466749161473,61,16,0.19124249794962592,"Semana intensa en Lima Este. Comenzamos en SJL de lunes a miercoles. El viernes en Ate, ayer Chaclacayo y hoy gran caminata en Chosica. Gracias a todos por escuchar y por el cariño recibido."
2018-09-03 02:47:58,1036445671249911810,4,1,0.7420240616524139,Barrio de mi abuelo. Ya voy
2018-09-03 13:25:54,1036606209309241344,117,23,0.22855599934267481,Nuestra en manos de Dios en este momento. Él actúa a través del Dr. Henry Pacheco. Sumemos oraciones. Ella entró a la intervención llena de fe y va a salir bien.
2018-09-03 21:24:53,1036726751244763136,202,27,0.5230945188663875,"Yola en UCI. Ella es re fuerte y el médico el jor, pero hay que esperar 24 horas antes de cantar victoria. Mantengamos la cadena de oración por ella."
2018-09-04 20:44:59,1037079096633778176,84,14,0.07013119416991642,"dejó UCI y pasó a cuarto. Está agradecida al Grupo Trelles jefe de neurocirugía, al Dr. Henry Pacheco por su profesionalismo y al personal que está pendiente de ella en todo momento. Y agradece a todo el Perú por sus muestras de cariño. En minutos declara el médico"
2018-09-05 18:20:00,1037405000803278848,299,84,0.7448166908131655,Este es un buen resumen de algunas de nuestras principales ideas para lograr una
2018-09-06 00:23:36,1037496500820041728,89,23,0.06723688768119059,Hoy almorcé con las madres del vaso de leche. Ellas saben quién les miente y quién les habla con la verdad. Firmados están mis 6 compromisos con ellas. Los niños primero.
2018-09-06 07:14:06,1037599807999815680,162,12,0.6417864170173383,Lo extrañamos todos
2018-09-06 07:50:18,1037608917025599488,1,0,0.08122169112333959,"Ayúdame, pasa la voz. Que el poder del dinero no vuelva a imponerse"
2018-09-06 07:51:14,1037609154515554304,1,0,0.39979006127466254,Potsupuesto. Está en el plan. Esto es solo un resumen
2018-09-06 07:53:37,1037609751310475264,0,0,0.7470453418727396,De acuerdo
2018-09-06 07:57:14,1037610662367846400,2,0,0.4386715812711571,En Ancón debe estar el tetminal terrestre del norte. Y hasta allí debe llegar la línea 3 del Metro.
2018-09-06 07:57:40,1037610772753539072,1,0,0.33163247024139636,Ayúdame a difundirla
2018-09-06 07:59:04,1037611123766439936,4,1,0.694896332683055,Merece ser feliz. Y eso es imposible sin seguridad. Es lo primero
2018-09-06 08:02:54,1037612090066968576,4,2,0.2216268059986907,Bueno leerte y saber de ti. Muchas de las cosas q aprendí de unidos contra el crimen está en mi propuesta. Ayúdanos rebotándola.
2018-09-06 17:51:11,1037760133672198144,26,3,0.03774040877286431,"Los 11 de Perú que vuelve a la cancha en una hora: Gallese; Advíncula, Ramos, Santamaría, Trauco; Aquino, Yotún; Carrillo, Cueva, Loyola y Farfán. A la 1.15pm abrimos comentarios previos por facebook live de"
2018-09-06 18:55:37,1037776349082083328,100,7,0.21994277631127546,"¿Por qué no pateaste Carrillo? Allí se define, no se pasa la pelota."
2018-09-06 19:00:51,1037777665166594049,5,0,0.2456241855796325,Bien Farfán en primera. Bien el arquero
2018-09-06 19:00:51,1037777665166594049,5,0,0.2456241855796325,Bien Farfán en primera. Bien el arquero
2018-09-06 19:02:25,1037778061377380352,51,7,0.535141599021722,"Golllll Aquino de cabeza a los 12. Buen centro del córner y muy bien Aquino ganando la posición. Tres llegadas de Perú, un gol. Ninguna de Holanda. Buen comienzo."
2018-09-06 19:18:15,1037782047463493634,4,0,0.7169762985831365,Primera clara de Holanda en 28 minutos. Se quedó defensa peruana y Depay erró con arco a disposición
2018-09-06 19:22:47,1037783186003161089,4,0,0.3946343966237911,2da. de Holanda. Zurdazo de Blind. Tras el.gol hemos perdido la pelota.
2018-09-06 19:25:14,1037783805363453952,1,0,0.2784624309029162,"Esta vez Sneijder la mandó a las nubes. 3ra de Holanda, ojo."
2018-09-06 19:54:33,1037791182288498689,12,0,0.2595210202820533,"Qué gran comienzo. En segundos de inicio, Trauco de derecha iba a hacer golazo y de allí seguidilla ofensiva con varias opciones y lucimiento de arquero."
2018-09-06 19:54:49,1037791246591426562,2,0,0.38846992960076515,Otra vez Perú a los 2 del 2do Farfán.
2018-09-06 19:56:16,1037791612707987457,1,0,0.24751122173607473,"3 minutos, vuelto de Holanda. Bien Gallese en su palo."
2018-09-06 20:01:45,1037792994374701058,1,0,0.36545487644322744,"Vormer falla dos seguidas. Esta segunda, solo. Golpe a golpe ha comenzado el complemento."
2018-09-06 20:09:19,1037794897737273346,6,2,0.023336712456272835,14 del segundo. Falla Perú en salida. Sandoval mal en su primera jugándola por el medio y Aquino en el control. Gol de Depay definiendo solo. 1-1.
2018-09-06 20:11:31,1037795449812512775,1,1,0.4670427868267272,Insiste Holanda. Tres buenas de Gallese.
2018-09-06 20:15:18,1037796402884165637,2,1,0.006965183601937225,Calcaterra por Carrillo. Antes fue Sndoval por Trauco
2018-09-06 20:24:48,1037798792479875072,2,0,0.7328375471496297,Ahora veremos a Abraham por Satamaria.
2018-09-06 20:25:21,1037798930455642112,12,0,0.36785971695271724,Le estan ganando espaldas a Loyola hace rato.
2018-09-06 20:26:50,1037799307200655362,5,0,0.2019374309603992,"Peña.por Aquino. Es más ofensivo. Hace rato manda Holanda, hay que recuperarla y jugar."
2018-09-06 20:31:19,1037800432817586177,15,0,0.01330618025333564,Se adelantó Perú y en contragolpe perdimos. 2-1. Las dos veces nos agarraron mal paeados.
2018-09-06 20:35:55,1037801593377316864,3,0,0.541333260777616,Cartagena por Yotun
2018-09-06 20:36:50,1037801820784082944,3,0,0.12049153355169046,Farfán tuvo el empate de cabeza. Se la taparon bien.
2018-09-06 21:54:58,1037821484285272064,729,57,0.1108338151927363,"Yola salió de alta. Sana, contenta y agradecida con médicos, personal de la clinica, prensa preocupada y los miles que sumaron sus oraciones e hicieron sentir su afecto. Ahora debe guardar reposo absoluto en su casa. En pocos días la tendremos como siempre, dirigiéndose a todos."
2018-09-07 21:14:12,1038173615022399488,57,11,0.07546065584064507,"Con fe Javier. Ya conoces la historia de las encuestas. La honestidad tiene que derrotar a la corrupción. En los próximos 30 días, Lima necesita volver a creer que sí se puede. Ayúdame a lograrlo."
2018-09-07 21:14:12,1038173615022399488,57,11,0.07546065584064507,"Con fe Javier. Ya conoces la historia de las encuestas. La honestidad tiene que derrotar a la corrupción. En los próximos 30 días, Lima necesita volver a creer que sí se puede. Ayúdame a lograrlo."
2018-09-08 05:35:07,1038299674791305216,47,12,0.8444397032582313,Me sumo al homenaje
2018-09-08 13:05:23,1038412988456349696,0,0,0.32823650481604266,68
2018-09-08 19:01:10,1038502523630497792,92,17,0.23011586883665502,Dejando Manchay. Rumbo a Lurín. Caminando por ina
2018-09-09 14:20:32,1038794285326520320,63,6,0.30173197724537426,Hoy jugamos otra vez ¡Vamos Perú!
2018-09-09 14:28:30,1038796290736447488,2,0,0.34945190324160763,1.45pm.
2018-09-09 17:42:07,1038845018994368513,43,10,0.09256727377048396,Hoy desde la 1.15pm la previa del Perú-Alemania por facebooklive en la página de Goles en Acción. Luego los comentarios de entretiempo y al final del partido. Los comentarios durante el juego los haremos por este tweeter. Hoy en directo desde la Plaza de Armas.
2018-09-09 18:59:16,1038864433014091777,12,1,0.5392633857114142,Primeros 10. Alemania aprieta y exige a Perú. Buena prueba
2018-09-09 19:01:24,1038864968874115074,6,0,0.01912118434875459,No puede cabecearnos tan solo
2018-09-09 19:08:22,1038866721338281984,4,0,0.06492898661805549,"Si nos están ajustando así, no se puede salir por el centro llevando lento."
2018-09-09 19:12:21,1038867726218022912,21,1,0.020235633103475,"22' Advincula. No habia aparecido todavia. Llegó, explotó como solo él y pateó cono se debe. Alli hay que patear."
2018-09-09 19:13:08,1038867921886474241,10,0,0.5993408494218007,Muy rápido el.empate
2018-09-09 19:14:10,1038868182088466433,4,0,0.24030887600381542,Hay que trabajar mucho en las salidas.
2018-09-09 19:26:14,1038871219263746049,30,2,0.22821502001607621,Jugando bien Alemania. No cotrola Perú. Crece Gallese bien parado.
2018-09-09 19:53:12,1038878004104126469,7,1,0.5488854064145706,Para comenzar el 2do... casi Ruidiaz.
2018-09-09 19:56:10,1038878749750697984,8,1,0.19837531038692227,"Lo.mejor de la primera mitad fue el marcador. Perú mal parado, le cuesta recuoerar y salir. Cim Yotun y Cueva muy mixtos, queda demasiado solo Aquino de ancla y lo superan fácil. Hay que corregir"
2018-09-09 20:00:39,1038879879582961665,5,0,0.16778236012218445,"Benos minutos de Perú, apretando. Cuidado con el contragolpe alemán."
2018-09-09 20:17:25,1038884100650741762,20,0,0.38617025097479835,Debut de Marcos Lopez. 18 años.
2018-09-09 20:27:58,1038886752549855232,5,0,0.6864101814494614,Cada vez más gente llegando a la Plaza de Armas para ver a Perú.
2018-09-09 20:29:54,1038887241437859842,20,2,0.19969601295976777,"Se rechaza para fuera, para adelante, para el lado. Jamás por el centro. Gol alemán."
2018-09-09 20:29:54,1038887241437859842,20,2,0.19969601295976777,"Se rechaza para fuera, para adelante, para el lado. Jamás por el centro. Gol alemán."
2018-09-09 22:18:11,1038914489486323713,32,7,0.09088307005486743,"Fin de la transmisión por el facebook live de ""Goles en Acción"" con el antes durante y después del Alemania-Perú. Falta en la foto que partió pronto."
2018-09-09 22:19:03,1038914710635249666,16,2,0.7185131400821237,Desde la Plaza de Armas de Lima.
2018-09-10 06:31:20,1039038595972120576,38,5,0.155037868308907,¿tan desesperados están para mentir de esa forma?
2018-09-10 06:33:35,1039039162085781504,10,0,0.039814547464019634,"Gomes en Acción, el.programa de fb en el que trabajo, transmitió desde allí. Y sobre la respuesta popular, los que alli estuvieron saben la verdad. Feo mentir muchachos."
2018-09-10 20:45:04,1039253446040399872,180,44,0.34520686481622376,"La corrupción que nos devora, nace de una mala decisión del votante. No podemos equivocarnos de nuevo."
2018-09-10 21:27:59,1039264247824506880,7,0,0.012967327139204718,"No te dejes engañar esta vez. No votes por el que tiene antecedentes. Mira su pasado y su presente, para que sepas cual será el futuro. La culpa de nuestras malas autoridades es nuestra. El origen de la corrupción es nuestra mala decision"
2018-09-10 21:30:54,1039264982079365121,3,2,0.15436620579632696,Renuncue a la reeleccion congresal por esa alianza. Y las propyestas estan wn un plan de gobierno que es considerado entre los mejores por los expertos. No estamos tarde. Hay que elegir bien para detener la corrupción
2018-09-10 22:25:22,1039278687793950720,21,2,0.029420130472230615,"Directo: voy a perseguir, combatir y extirpar la corrupcion de la Municipalidad. Sin eso, todo lo demás son promesas vacias. La corrupcion impide que arreglemos el tráfico o la seguridad. Directo: si no priorizas elegir a uno honesto, todo seguirá igual"
2018-09-11 07:01:40,1039408616917360640,2,0,0.04999470528762521,"Si te sientes mejor, cree eso y sigue siendo parte del problema, votando por el que te engañe más bonito. Pero no, no todos somos iguales, no todos engañan y es fácil diferenciarlos."
2018-09-11 07:04:21,1039409292594618368,10,5,0.10661924285877176,Votar viciado es la mejor forma de contribuir con la corrupción. No todos somos iguales. Vota por uno honesto.
2018-09-11 07:06:59,1039409956322271232,5,4,0.0740441514633545,Soy. 40 años de vida pública sin tachas ni escándalos lo demuestran.
2018-09-11 16:45:59,1039555667089080320,20,5,0.9766727230457198,Buenos consejos para elegir bien.
2018-09-11 16:49:24,1039556524564258818,0,0,0.1635320953884225,Aunque no haya filtro alguno. Quien elige sigue siendo del votante. Es su responsabilidad.
2018-09-11 16:52:17,1039557251030294535,3,0,0.29425695865274476,"Las chance son enormes, me li dice ka calle a diario. Solo necesito tu convicción y que no te dejes llevar tan fácil. No evalúes la campaña sino la persona."
2018-09-11 16:56:29,1039558307827122176,2,2,0.00017699812410637659,"Si quieres convencerte de la integridad de alguien, mira su pasado. Si esperas que te convenzan, te expones ser engañado. A propósito, a mi no me financia nadie y me aconpañarán los técnicos más competentes."
2018-09-11 17:00:36,1039559344650629120,2,0,0.1324507039408679,Asi es. Pero esos operadores cirruptos desaparecerian si eligiéramos gente honesta en las elecciones
2018-09-11 17:09:06,1039561484118974466,2,0,0.5403929043686081,"Administrando empresa, la mia propia, que generó los éxitos más recordados en la TV deportiva peruana. Administrando ciudad la de mis acompañantes, acaldes, regidores y técnicos competentes y honestos que ya demostraron su eficiencia. Pero además..."
2018-09-11 17:10:37,1039561864106131458,4,3,0.6381581726675244,"Además, cuento con la experiencia del PPC, el Partido más municipalista del Perú y el consejo permanente del mejor Alcalde que tuvo Lima en su historia: Luis Bedoya Reyes."
2018-09-11 18:07:26,1039576165181214720,3,3,0.032071358531340854,"El votante tiene la alternativa de elegir sabiendo que hay corruptos en esa lista. El votante es un ciudadano, no un niño. No sigamos quitándole responsabilidad."
2018-09-11 18:07:26,1039576165181214720,3,3,0.032071358531340854,"El votante tiene la alternativa de elegir sabiendo que hay corruptos en esa lista. El votante es un ciudadano, no un niño. No sigamos quitándole responsabilidad."
2018-09-11 18:47:10,1039586161621172224,5,2,0.14822309215118037,"Siempre hay oportunidad. No se resigne. Siempre hay por lo.menos uno honesto. No mire programas ni promesas, mire pasados de los candidatos. Si se puede"
2018-09-11 19:30:23,1039597037493411841,27,1,0.6631113835060599,Un abrazo a los contadores en su día.
2018-09-11 22:04:12,1039635747270213632,33,11,0.6771237738674438,"Esto es buenísimo. Tenemos que recuperar el afán de ayudar de nuestros jóvenes, su capacidad para comprometerse, su espíritu altruista, su trabajo voluntario sin esperar más recompensa que la de saber que están haciendo el bien. Los Panamericanos son una gran oportunidad."
2018-09-11 23:36:31,1039658980702867456,563,106,0.02027285586451115,"Cadena perpetua para Abimael, Yparraguirre, Feliciano, Morote, Artemio y otros por Tarata. Se hace justicia. Viva el Perú."
2018-09-12 15:23:36,1039897319624400898,872,107,0.0516275948566972,"Un día como hoy, hace 26 años, pude dar la primicia más esperada, la captura de Abimael Guzmán. Yo transmitía una pelea de box cuando me informó el practicante de prensa. Era increible. Dejé la transmisión y no volví hasta reconfirmar, para dar esa alegría al país. Viva el Perú."
2018-09-13 03:15:46,1040076542548815873,60,4,0.016700238832988174,Primero dijimos por un cintillo que se habia caoturado a un importante cuadro terrorista. A los minutos dije que era Abimael Guzman. Nunca he dado una noticia sin confirmar. Abrazo.
2018-09-13 06:09:54,1040120364758642689,2,0,0.046929442558259725,Esa pelea la transmitimos Jorge Balarin y yo. Alli di la noticia
2018-09-13 22:05:56,1040360958093414400,20,3,0.32823650481604266,
2018-09-13 22:08:39,1040361642213761026,0,0,0.9690013956731391,Inolvidable
2018-09-13 22:11:52,1040362455250206720,1,0,0.624938256757649,"De acuerdo. Detrás mio está toda la gran experiencia municipal del PPC y el consejo lúcido de Luis Bedoya Reyes, el mejor Alcalde que ha tenido Lima."
2018-09-13 22:18:03,1040364007503405056,1,0,0.09426857578680414,"Claro, ya después por la noche todos siguieron dando la noticia y luego saldria el video."
2018-09-13 22:25:46,1040365952590856192,5,3,0.16131613929668276,"Una candidata elegida en internas libres del PPC. No voy a apoyar a tu candidata de Solidaridad, el q postula al hijo. No te pases."
2018-09-13 22:29:32,1040366899132071936,19,3,0.08814827582551016,Lo vengo pidiendo desde que comenzó la campaña. Una autoridad única es la forma de eliminar la corrupción y resolver el transporte público.
2018-09-14 00:13:17,1040393008607383552,243,49,0.22466784650065816,¡Bravo! Lo pedimos desde que se inició la campaña. El Congreso acaba de aprobar la creación de la Autoridad de Transporte Unica para Lima y Callao. No importa quien lo haga. Lima lo necesita. Comenzamos a resolver los problemas.
2018-09-14 18:09:50,1040663932925628416,1,0,0.18641300883158876,"""Una actitud positiva, causa una reacción en cadena de pensamientos, sucesos y resultados positivos"". Buena idea. Pregunta por favor."
2018-09-15 01:10:03,1040769681685135360,0,0,0.128154735448415,"Porque quiero dejar una ciudad a mis hijos donde puedan ser felices, porque en el PPC sabemos cómo lograrlo (lee el plan), porque alguien tiene que enfrentar la corupción para poder salir adelante y no me siento bien mirando. Porque necesitamos un Alcalde de acción y honesto."
2018-09-15 01:12:45,1040770362873667584,13,1,0.5113410675577647,"Mira el video Cesar. Se explica solo. Lamento que quieran hacer burla de un discurso indispensable para la ciudad. Los crei más serios, pero buscaron show como otros."
2018-09-15 01:12:45,1040770362873667584,13,1,0.5113410675577647,"Mira el video Cesar. Se explica solo. Lamento que quieran hacer burla de un discurso indispensable para la ciudad. Los crei más serios, pero buscaron show como otros."
2018-09-15 01:17:01,1040771434900017157,0,0,0.0630713632190773,"Un montón. Solo para comenzar, hay que exigir que se cambie la composición del directorio de ese Organisno. La mayoria y presidencia la debe tener Lima, no el Ejecutivo. Es Transporte de Lima"
2018-09-15 01:19:14,1040771993719717893,1,0,0.22990371312621494,Para educar no se necesita más que deseos y capacidad. Nadie puede decirle a la Municipalidad que no eduque. Hay que hacerlo. Gracias
2018-09-15 01:35:37,1040776115944677376,191,22,0.0019344395442159623,¿y por qué no me dijiste allí que sonaba demagogo? ¿por qué no me lo preguntaste en ese momento cono eliminar corrupción? ¿Ahora resulta que no era una entrevista sino un examen? Lamento la poca seriedad.
2018-09-15 02:06:09,1040783799687303168,1,0,0.07462658115422913,"En nuestra peopuesta eran 2 directores de Lima, uno del Callao, uno de provincuas aledañas y 2 de MTC. Hay que lucharla"
2018-09-15 07:12:38,1040860929997643776,1,0,0.39752814281005405,"En parte. Ahora hay que pedir modificar la ley en composición de directorio. En nuestra propuesta eran 2 de Lima, 1 de Callao, 1 de munis aledañas y 2 de MTC con presidencia de Lima. En Ley son 4 de Ejecutivo q presdie y 4 de munis imcluyendo Lima. No pues, es transporte de Lima"
2018-09-15 20:07:42,1041055983240441860,87,15,0.018494444086682413,"Por el aniversario de fundación de la PIP, un abrazo para todos lo policías del Perú, dedicados a la investigación criminal. Necesitamos más que nunca su profedionalismo."
2018-09-16 01:21:16,1041134892132851712,76,17,0.5273347501874562,"Solo palabras de gratitud para el cariño recibido hoy en El Rímac y el Cercado. En mi encuesta diaria, seguimos arriba y subiendo. Emocionante. Gracias."
2018-09-16 08:47:58,1041247308933943296,1,0,0.15192833188895405,Justo hoy he grabado un video en el río Rímac. Lima le debe la vida y solo lo hemos maltratado siempre.
2018-09-16 18:19:59,1041391260949508097,89,12,0.8438972303617384,"Alegría, honestidad y propueatas serias de Caminando las calles de Lince."
2018-09-16 23:16:11,1041465802069864448,17,3,0.5862495690763911,"Con Jorge Olaechea en Punta Hermosa, distrito que progresó con el PPC y que seguirá avanzando con él"
2018-09-16 23:51:18,1041474641020289024,28,2,0.5060104282274916,Ahora asistiendo al debate de candidatos distritales en San Bartolo. Muy bien David Hau.
2018-09-17 01:58:37,1041506680067026944,2,2,0.652972139955668,No. La foto muestra la.mesa con los 6 candidatos. La tomé desde la tribuna. Las 3 tribunas estaban llenas.
2018-09-17 06:11:45,1041570384112431104,29,2,0.08573875074956104,"Discrepo con detalles de los PL presentados, pero es clara su intención de reforma y lucha contra la corrupción. Congreso tuvo oportunidad de corregirlos y mejorarlos, pero ha sido clara su intención de entorpecer y dilatar. Consecuencia: otra crisis que los peruanos no merecemos"
2018-09-17 06:11:45,1041570382313082881,228,38,0.33259825805798354,"Tras el respaldo al Presidente No estoy de acuerdo con el 100% de las propuestas que alcanzó al Congreso, ni con las formas que ha elegido, pero ninguna discrepancia, por ahora menor, debe entorpecer nuestra lucha contra la corrupción."
2018-09-17 06:11:46,1041570389405704192,83,10,0.150560280039905,"Hay que tomar partido por la lucha contra la corrupción. Como siempre, fuerte y claro. Mejor era el diálogo y el consenso, pero eso fue mucho pedir. Por ahora, baste con cerrar filas todos aquellos que queremos de verdad desaparecer la corrupción del sistema político peruano."
2018-09-17 06:11:46,1041570385890877440,18,2,0.014966211345447513,"Las urgentes reformas que requieren nuestra administración de justicia y nuestro sistema político, ya habrían alcanzado consensos y estarían encaminadas, si todos pusiesen PerúPrimero. Si en lugar de pelear hubiesen trabajado por el Perú, nos habríamos ahorrado este momento"
2018-09-17 06:11:46,1041570387610529792,13,3,0.3014795341714986,"Lamentablemente, el Legislativo y ahora el Ejecutivo han preferido la confrontación, que solo aumenta el hartazgo de la población para con unos políticos que no están a la altura que el país requiere. Así están las cosas. Y con el conflicto planteado no caben medias tintas"
2018-09-17 06:11:47,1041570391238557696,316,60,0.27852342709423655,"Respaldo la Respaldo al Presidente Ya luego discutiremos y se corregirán los proyectos presentados por el Ejecutivo, para llegar a reformas verdaderas que solucionen los problemas de fondo,"
2018-09-17 06:11:47,1041570391238557696,316,60,0.27852342709423655,"Respaldo la Respaldo al Presidente Ya luego discutiremos y se corregirán los proyectos presentados por el Ejecutivo, para llegar a reformas verdaderas que solucionen los problemas de fondo,"
2018-09-18 00:34:15,1041847835845640192,104,48,0.5055747806549293,"Honestidad, acción y más honestidad. SIN TREGUA."
2018-09-18 02:31:40,1041877385002536961,2,0,0.010889741197367755,"Para vivir más seguros necesitamos programas que prevengan el delito, basados en educación, deporte y oportunidades laborales, para sectores vulnerables. Necesitamos fortalecer y empoderar a la policía y asegurarnos que fiscales y jueces castiguen a delincuentes."
2018-09-18 02:34:08,1041878004815876097,1,0,0.17673526436964268,"Para lograro, tenemos todo un equipo de profesionales listo y unos programas aplaudidos para la prevención, otros parala obstaculización y otros para el castigo del delito. Y un candisato a Alcalde listo para liderar y asegurar con fiemeza que cada uno haga su trabajo."
2018-09-18 02:35:18,1041878300321374209,2,0,0.10761207602947416,Gracias por permitirme el comentario. Vamos a limpiar Lima de la corrupcion y asi liderar los grandes trabajos que se necesitan
2018-09-18 02:45:33,1041880880531161089,2,0,0.38399983568697216,En 120 caracteres hay que resumir ideas buscando una palabra. Quiere decir aprobado por expertos y con buenos comentarios de prensa y entendidos
2018-09-18 16:00:06,1042080834126311424,1,0,0.06360850451804988,"El PPC es el de mayor experincia edil. Mi lista está llena de Alcaldes, regidores y funcionarios municipales."
2018-09-18 19:54:48,1042139896880812033,1,0,0.004008459957251178,"La honestidad del candidato. No todos son corruptos. Hay q elegir bien. Por eso, si eliges a alguien q sabes q no es honesto, ¿de quién es la culpa?"
2018-09-19 02:53:53,1042245365012070401,8,0,0.7196670663303683,Merecido señor.
2018-09-19 13:40:57,1042408202321764352,1071,148,0.7223393891483488,Vamos subiendo. Las encuestas y las calles lo dicen. Los honestos somos más felizmente.
2018-09-19 13:57:20,1042412327360974850,28,2,0.3444700060096982,No quiero. Los estoy usando. Las billeteras gordas a las que me enfrento no me van a detener. Seguiré caminando las calles
2018-09-19 14:00:32,1042413133921497088,5,0,0.8023663130244759,Está calando. Y subiendo.
2018-09-19 15:09:05,1042430383093149697,1,1,0.4267292550622775,Rocio Cano
2018-09-19 15:13:20,1042431451973804032,4,0,0.7470453418727396,De acuerdo
2018-09-19 17:20:48,1042463531038371840,67,19,0.43901271315752943,Los espero.
2018-09-20 15:43:19,1042801385715195906,0,0,0.32823650481604266,
2018-09-20 15:43:52,1042801524420870145,0,0,0.32823650481604266,
2018-09-20 16:02:07,1042806119360540672,417,267,0.04182203956244531,"Inaceptable intromisión de ONPE. Ha citado a todos los medios de TV a un ensayo, para cubrir desde dentro de los locales de votación, la votación de solo 5 candidatos, con sorteo de ubicación de cámara incluido. Inaceptable que el organizador se parcialice de esa forma."
2018-09-20 16:04:36,1042806744517365761,145,38,0.1407538023270358,Peor sabiendo la enorme cantidad de gente que decide su voto el último día. Eso es orientar el voto. Inaceptable.
2018-09-20 16:04:36,1042806744517365761,145,38,0.1407538023270358,Peor sabiendo la enorme cantidad de gente que decide su voto el último día. Eso es orientar el voto. Inaceptable.
