fecha,idT,Likes,ReTweets,Positividad,txt
2018-09-20 19:02:42,1042851561892978692,27,9,0.034988336603496824,Ayuda. La explicación que me han dado por teléfono no es creible. Necesitamos que se activen observadores.
2018-09-21 00:45:55,1042937935035805698,32,5,0.7774161242569767,Hoy es aniversario del Santiago Barranco. Aqui en un aniversario antguo con el gran Hector Chumpitaz. ¡Yo soy pirata! ¡Feliz día Piratas!
2018-09-21 06:00:40,1043017145574019072,73,23,0.0008176436433455102,"No es cierto. Yo hice la denuncia al ser advertido por 2 canales de TV que me pasaron un cronograma donde se incluye solo 5 candidatos. Evidentemente, quienes me advirtieron, solicitaron mi cobertura. De hecho a través del teléfono, ONPE ofreció incluirme. No me van a callar asi."
2018-09-21 06:01:45,1043017416790274049,5,1,0.04568224183331425,Es a todos o a niguno. De lo contrario estarán orientando el voto.
2018-09-21 06:04:02,1043017993414823936,0,0,0.32823650481604266,
2018-09-21 06:05:55,1043018465861197824,2,0,0.0059666082467451954,"Explíquenme por favor este correo.electrónico, en lugar de tratar de tapar el sol con un dedo"
2018-09-21 06:06:24,1043018586929786881,0,0,0.32823650481604266,
2018-09-21 06:08:27,1043019105463201792,19,9,0.012828374765536884,"Por telefono me dijeron que habia sido un torpeza de su parte ese correo. Expliquen por favor por qué. Y recuerden que su tarea constitucional es garantizar elecciones limpias, no jugar en contra de ningún candidato."
2018-09-22 16:05:50,1043531827883991040,58,16,0.31956707821359703,Esta historia tuvo final feliz. ONPE entendió razones y canceló evento que favorecía a 5 candidatos. Se hará la próxima semana y dará igual trato a los 20. Reconfortante que la autoridad rectifique cuando es justo. Estas elecciones deben ser y parecer transparentes e imparciales.
2018-09-22 16:08:41,1043532544615088133,1,0,0.5488870558852394,"Ya está, no fue pataleta, fue la defensa de un derecho. Tuvimos la razón y se detuvo. Ahora seguimos subiendo. Ya veremos el 7 de octubre, ojalá vuelvas a equivocarte. Bendiciones."
2018-09-23 04:29:35,1043719000172244993,93,3,0.9417961287968175,"Terminando el día cin buenos amigos, viendo a la mejor ¡Viva el Perú!"
2018-09-23 23:30:22,1044006087891054592,41,12,0.7375538119710037,Feliz dia de la juventud.
