fecha,Positividad,Likes,ReTweets,txt
2018-08-19 01:52:12,0.11978115205296233,0,0,Ten por seguro que haremos obras en beneficio de ustedes que solucionarán su día a día. La propuesta de cambio que ofrecemos es real nuestra gestión no hipotecará el Municipio de Lima
2018-08-19 01:54:34,0.06529815656932039,1,1,"Yo tengo recursos propios y de mi familia para solventar mi campaña, no necesito de espaldarazos para poder hacerlo. Esa pregunta deben hacerla a los otros candidatos. Yo soy Esther Capuñay ."
2018-08-19 01:56:45,0.040855054077898176,1,0,No debemos crear divisiones de izquierda y derecha. Lima necesita en este momento personas que decidan ponerse la camiseta para hacer posible el cambio que Lima necesita. Lima debe forjar la unión no separación.
2018-08-19 01:58:55,0.3435474237100715,1,2,"Exactamente, se esta orquestando una campaña dirigida en mi contra provocada porque somos una propuesta que no va a permitir que continúen los mismos haciendo lo que quieren con la Municipalidad de Lima. El vecino es primero, segundo y tercero."
2018-08-19 02:03:46,0.011587719156361899,0,0,"Es lamentable seguir viendo lo mismo, lo sucedido en Cerro Azul nos marca más fuerte el camino que debemos seguir. Crearemos espacios de prevención, protección, restablecimiento de la victima y familia así como la ciudadanía, PNP y municipio debe ser parte activa de la solución."
2018-08-19 15:29:46,0.4618029816857848,44,34,"Siempre dicen que el tiempo cambia las cosas, pero de hecho tienes que cambiarlas tú mismo. El momento de hacerlo realidad llegó, este 7 de octubre haremos posible el gran cambio que Lima necesita."
2018-08-19 17:03:46,0.19755941987503328,41,30,"Hoy celebramos el Día del Niño tenemos la obligación de velar por el bienestar, protección integral y la aplicación de los derechos fundamentales de los niños limeños."
2018-08-19 19:04:21,0.9304795771923016,40,32,Estamos recorriendo las calles de Surco junto con nuestro candidato llevando nuestras principales propuestas de trabajo para erradicar la inseguridad ciudadana y congestión vehicular.
2018-08-19 23:50:34,0.7289349820634455,37,31,Nos encontramos en el distrito de El Agustino en la inauguración de nuestro local de campaña. Gracias por su respaldo y cariño seguimos avanzando. Síguenos en vivo aquí ➡
2018-08-20 00:03:52,0.23979559067124642,4,1,No tengo proceso ni sentencia que me impida postular a la Alcaldía de Lima
2018-08-20 00:03:52,0.23979559067124642,4,1,No tengo proceso ni sentencia que me impida postular a la Alcaldía de Lima
2018-08-20 14:26:58,0.723009996242826,40,31,Trabajaremos juntos para construir una Lima mejor.
2018-08-20 15:22:28,0.261097693019145,1,0,Cuando hablo de herencias me refiero a herencias políticas. No podemos permitir que una persona que fue elegida por voto democrático pretenda hacer una nueva gestión a través de su familia.
2018-08-20 18:14:29,0.806548504388511,34,28,Este Jueves 23 de Agosto nos encontraremos nuevamente con nuestros vecinos de a las 7 pm en la intersección de Av. César Vallejo frente a la Municipalidad de Villa El Salvador.
2018-08-20 23:25:13,0.8731241838033658,42,31,"Estamos preparados para actuar. Lima merece un cambio, merecemos tener la ciudad segura y ordenada que siempre hemos querido."
2018-08-21 01:46:46,0.9077879269630172,37,29,"Seguimos recorriendo Lima, en este momento estamos en la Av. Arequipa llevando nuestro mensaje de cambio para los Limeños. Síguenos en vivo aquí ➡"
2018-08-21 13:34:18,0.1663867154341899,36,30,"No nos dejemos engañar por quienes tienen solo ambición de poder. Llegó el momento de renovar Lima, de devolverle nuevamente su espíritu. Están llegando nuevos tiempos, juntos lo podremos lograr."
2018-08-21 15:10:37,0.006470562740104541,31,26,La falta de liderazgo y compromiso con la ciudad produce la inacción de sus autoridades para solucionar estos problemas. Estamos poniendo en riesgo la integridad y seguridad del ciudadano. Pongámonos la camiseta de Lima.
2018-08-21 17:29:46,0.2692842469749632,33,29,"Gracias a la empresa San Pablo por su cariño y respaldo, juntos cambiaremos Lima"
2018-08-21 20:59:41,0.5937810969414509,26,23,Lima y La Molina trabajando juntos reorganizaremos la circulación de transporte pesado en nuestras calles.
2018-08-21 22:58:34,0.8464294348739398,36,28,"Tenemos la posibilidad para poder hacer de Lima un gran lugar en el que podamos conseguir nuevas oportunidades para todos, más trabajo, más salud, más orden."
2018-08-22 13:45:33,0.8919945862944977,35,26,Lima volverá a ser la ciudad que nos ofrecerá bienestar. Es tiempo de sumarnos a esta etapa de renovación para que Lima sea reconocida por ser una ciudad linda y con oportunidades para los limeños. ✌
2018-08-22 14:28:03,0.23979559067124642,0,1,No tengo proceso ni sentencia que me impida postular a la Alcaldía de Lima
2018-08-22 20:13:31,0.966859443210828,36,27,"Haremos de Lima una ciudad saludable, ofreceremos al limeño espacios sostenibles donde se darán las condiciones para generar oportunidades para el desarrollo físico, ambiental y cultural."
2018-08-22 23:33:49,0.9596336281727151,31,25,"Soñamos con una ciudad integradora, verde y cultural. Con el poder de tu voto ✌ construiremos y haremos de Lima una ciudad con visión innovadora para los limeños."
2018-08-23 15:00:24,0.9917279567503426,33,25,"Soñamos con una ciudad integradora, verde y cultural. Con el poder de tu voto✌construiremos y haremos de Lima una ciudad con visión innovadora para los limeños."
2018-08-23 17:16:41,0.883742762091304,36,26,Tenemos la misión de recuperar los valores tradicionales de Lima debemos incluir también nuevos valores que nos llevarán a la modernidad. Trabajando juntos lo haremos posible.
2018-08-23 19:19:09,0.35254745383674185,38,29,La VERDAD ya tiene marca
2018-08-24 00:20:17,0.9312262106490166,38,32,Ya iniciamos nuestra noche de celebración y propuestas en Lima Sur. Estamos en el cruce de Av. Cesar Vallejo y Av. Revolución en Te esperamos !
2018-08-24 03:04:03,0.21758347111501583,34,29,| Llevamos nuestro mensaje de esperanza para Lima desde . Síguenos en vivo aquí ➡
2018-08-24 11:22:21,0.12333458792204977,38,29,Desarrollaremos una gestión municipal donde asumimos el compromiso para priorizar todas las acciones que tengan como objetivo ayudar a mejorar la salud de los limeños.
2018-08-24 18:46:57,0.08403207146734924,33,30,Este Miércoles 29 de Agosto nos encontraremos con nuestros vecino de a las 6 pm en Av. Los Jardines cdra 2 - Ref. Metro de La Hacienda. Cambiar Lima depende de todos nosotros!
2018-08-24 23:32:27,0.9392034331640395,35,28,"Desarrollemos el sentimiento de alegría, esperanza y agradecimiento a nuestros adultos mayores. Brindemosle espacios de confianza para que se sigan desarrollando en un ambiente seguro y favorable."
2018-08-25 12:03:02,0.59716541411144,34,27,La realidad demanda soluciones rápidas a situaciones que afectan la calidad de vida del limeño. Con acciones concretas y políticas bien definidas haremos de Lima una ciudad de oportunidades para los limeños.
2018-08-25 19:52:29,0.6077997681376985,38,31,"Construiremos juntos una ciudad donde el talento, la innovación y el conocimiento de los limeños nos harán diferentes. Con el poder de tu voto ✌🏻 haremos el cambio para Lima."
2018-08-25 20:03:59,0.08663318202002551,36,27,| Recorriendo el distrito de SJL llevando nuestro mensaje de esperanza y cambio para Lima. Síguenos aquí ➡
2018-08-26 11:51:19,0.42501071151376263,45,35,Somos fuertes! Somos líderes! Somos mujeres!
2018-08-26 17:11:56,0.7419086734435214,40,28,"Agradezco a todos los vecinos de que estuvieron acompañándonos en nuestra gran noche de celebración y propuestas. Tu respaldo nos fortalece, seguiremos llevando nuestro mensaje de esperanza a todo Lima."
2018-08-26 17:36:32,0.532874445942708,34,25,"| Seguimos recorriendo Lima, nos encontramos en el distrito emprendedor de La Victoria. Muchas gracias por su respaldo, este 7 de octubre marquemos la ✌ de la Verdad y de la Victoria."
2018-08-26 20:08:42,0.1634067412570636,32,26,Seguimos en el distrito de La Victoria llevando nuestro mensaje de esperanza y progreso para todos los vecinos. Trabajando con lograremos los grandes cambios que necesita nuestra ciudad.
2018-08-26 23:13:02,0.16304067026916466,39,27,"Nos encontramos con los vecinos de Comas llevando nuestro mensaje de prosperidad, esperanza y progreso. Ya es tiempo de tomar decisiones para hacer de y lugares con oportunidades para todos✌✌✌"
2018-08-27 11:30:19,0.5342630958605394,42,30,A mi nadie me la cuenta! He trabajado desde muy joven para obtener lo que tengo y ahora quiero trabajar con esas mismas ganas para tener la ciudad que merecemos!
2018-08-27 17:19:49,0.8955669515765516,38,30,Juntos podemos hacer de Lima una ciudad segura para los nuestros✌
2018-08-28 00:38:19,0.1962140248283164,41,28,Solo unidos lograremos el cambio.
2018-08-28 14:04:33,0.3033853947321103,43,33,Nuestra capital merece que alguien se haga cargo de todos los problemas que nos vienen persiguiendo durante años. Llegó el momento de construir una Lima mejor!
2018-08-28 17:12:57,0.013271224836120659,37,31,Que nadie nos siga robando la esperanza. Basta ya de seguir engañando a los limeños con propuestas vacias Lima necesita acciones concretas. Votemos por ✌de la verdad.
2018-08-28 17:12:57,0.039725252375627795,37,31,Que nadie nos siga robando la esperanza. Basta ya de seguir engañando a los limeños con propuestas vacias Lima nece…
2018-08-28 23:04:02,0.8077807994349998,39,32,"Tenemos en nuestras manos la responsabilidad de hacer algo distinto por nuestra ciudad, esta lucha es de todos! Ma…"
2018-08-29 11:20:54,0.6715793031862066,38,25,Menos palabras y más acciones. Nuestra capital merece cambiar✌️
2018-08-29 13:38:21,0.1984663765491135,148,103,Señor Reggiardo: Ud. está poniendo en práctica lo más sucio de los años 90 porque lo lleva en el ADN.
2018-08-29 15:45:01,0.32823650481604266,1,0,
2018-08-29 15:46:42,0.32823650481604266,0,0,
2018-08-29 15:47:27,0.541333260777616,27,23,cc.
2018-08-29 23:21:44,0.7497826162051022,33,26,Hoy es nuestra noche de celebración y propuestas en Lima Este. Estamos en el cruce de Av. Los Jardines cuadra 2 -…
2018-08-30 01:32:42,0.8789016049041207,36,28,Ya estamos en celebrando nuestra noche de esperanza y de propuestas. Te esperamos en Av. los Jardin…
2018-08-30 02:41:36,0.1999700799582127,32,28,Ya estamos listos para brindar nuestro mensaje de esperanza desde ➡
2018-08-30 03:35:12,0.36085695654247674,41,36,| Desde brindando nuestro mensaje de esperanza para Lima. Síguenos en vivo aquí ➡…
2018-08-30 12:11:34,0.7074425621697747,49,43,Todos peleamos por un gobierno cooperativo.
2018-08-30 19:01:52,0.8232445724104713,60,46,"símbolo permanente de la conducta moral de los efectivos policiales, dadas sus excelentes virtudes…"
2018-08-30 23:50:22,0.009062529727666694,76,45,"Lima necesita cambios, no permitamos que las mismas personas pretendan quedarse con cargos públicos. Dejemos de lad…"
2018-08-31 12:14:47,0.7404948260701976,55,47,Somos los protagonistas de esta nueva Lima✌
2018-08-31 17:01:06,0.3142917139933863,50,45,"En nuestra gestión se acabaron las papeletas fantasmas, vamos a trabajar juntos para que nuestros amigos y hermanos…"
2018-08-31 20:07:37,0.541333260777616,37,34,Un mensaje desde San Juan de Lurigancho para toda Lima✌
2018-08-31 22:46:32,0.6483025797404752,12,6,"Nosotros sí estamos comprometidos con tener un gobierno honesto, por eso crearemos nuestro aplicativo LIMA TRANSPAR…"
